{
 "tokens": {
  "bg": "#E8E4DA",
  "fg": "#1B1B1F",
  "muted": "#6B6F76",
  "accent": "#C2410C",
  "card": "#F4F1EA",
  "line": "#D6D1C4",
  "sel": "#C2410C",
  "box": "#FBE9DF"
 },
 "roles": {
  "Title": {
   "font": "Georgia,'Times New Roman',serif",
   "size": 64,
   "weight": 700,
   "lh": 70,
   "ls": -1.2,
   "color": "var(--fg)",
   "cw": 0.5
  },
  "Supertitle": {
   "font": "Menlo,'SF Mono',Consolas,monospace",
   "size": 12,
   "weight": 500,
   "lh": 16,
   "ls": 1.5,
   "color": "var(--accent)",
   "tt": "uppercase",
   "cw": 0.73
  },
  "H1": {
   "font": "Georgia,'Times New Roman',serif",
   "size": 30,
   "weight": 700,
   "lh": 36,
   "ls": -0.3,
   "color": "var(--fg)",
   "cw": 0.51
  },
  "H2": {
   "font": "Georgia,'Times New Roman',serif",
   "size": 22,
   "weight": 700,
   "lh": 28,
   "ls": -0.2,
   "color": "var(--fg)",
   "cw": 0.51
  },
  "Body": {
   "font": "-apple-system,BlinkMacSystemFont,'Segoe UI',Roboto,sans-serif",
   "size": 16,
   "weight": 400,
   "lh": 24,
   "ls": 0,
   "color": "var(--fg)",
   "cw": 0.46
  },
  "Caption": {
   "font": "-apple-system,BlinkMacSystemFont,'Segoe UI',Roboto,sans-serif",
   "size": 13,
   "weight": 400,
   "lh": 18,
   "ls": 0,
   "color": "var(--muted)",
   "cw": 0.47
  },
  "Label": {
   "font": "Menlo,'SF Mono',Consolas,monospace",
   "size": 11,
   "weight": 500,
   "lh": 14,
   "ls": 1,
   "color": "var(--muted)",
   "tt": "uppercase",
   "cw": 0.69
  },
  "Stat": {
   "font": "Georgia,'Times New Roman',serif",
   "size": 40,
   "weight": 700,
   "lh": 44,
   "ls": -0.8,
   "color": "var(--accent)",
   "cw": 0.5
  }
 },
 "pad": {
  "chip": "3px 8px",
  "pill": "5px 12px"
 },
 "margin": 60,
 "gap": 4
}
