{
 "tokens": {
  "bg": "#EEEDF3",
  "fg": "#14121F",
  "muted": "#625E75",
  "accent": "#6D28D9",
  "card": "#FFFFFF",
  "line": "#DCD9E6",
  "sel": "#6D28D9",
  "box": "#EFE9FB"
 },
 "roles": {
  "Title": {
   "font": "'Avenir Next',Avenir,'Century Gothic',Futura,'Segoe UI',sans-serif",
   "size": 66,
   "weight": 700,
   "lh": 70,
   "ls": -2,
   "color": "var(--fg)",
   "cw": 0.47
  },
  "Supertitle": {
   "font": "'Avenir Next',Avenir,'Century Gothic',Futura,'Segoe UI',sans-serif",
   "size": 12,
   "weight": 600,
   "lh": 16,
   "ls": 2.5,
   "color": "var(--accent)",
   "tt": "uppercase",
   "cw": 0.79
  },
  "H1": {
   "font": "'Avenir Next',Avenir,'Century Gothic',Futura,'Segoe UI',sans-serif",
   "size": 34,
   "weight": 700,
   "lh": 40,
   "ls": -0.8,
   "color": "var(--fg)",
   "cw": 0.47
  },
  "H2": {
   "font": "'Avenir Next',Avenir,'Century Gothic',Futura,'Segoe UI',sans-serif",
   "size": 22,
   "weight": 600,
   "lh": 28,
   "ls": -0.3,
   "color": "var(--fg)",
   "cw": 0.46
  },
  "Body": {
   "font": "'Gill Sans','Gill Sans MT',Calibri,'Trebuchet MS',sans-serif",
   "size": 16,
   "weight": 400,
   "lh": 24,
   "ls": 0,
   "color": "var(--fg)",
   "cw": 0.41
  },
  "Caption": {
   "font": "'Gill Sans','Gill Sans MT',Calibri,'Trebuchet MS',sans-serif",
   "size": 13,
   "weight": 400,
   "lh": 18,
   "ls": 0,
   "color": "var(--muted)",
   "cw": 0.41
  },
  "Label": {
   "font": "Menlo,'SF Mono',Consolas,monospace",
   "size": 11,
   "weight": 500,
   "lh": 14,
   "ls": 1,
   "color": "var(--muted)",
   "tt": "uppercase",
   "cw": 0.69
  },
  "Stat": {
   "font": "'Avenir Next',Avenir,'Century Gothic',Futura,'Segoe UI',sans-serif",
   "size": 40,
   "weight": 700,
   "lh": 44,
   "ls": -1.5,
   "color": "var(--accent)",
   "cw": 0.46
  }
 },
 "pad": {
  "chip": "3px 8px",
  "pill": "5px 12px"
 },
 "margin": 60,
 "gap": 4
}
