{
 "tokens": {
  "bg": "#1F0901",
  "fg": "#FFDDAC",
  "muted": "#B98F67",
  "accent": "#FAAA48",
  "card": "#2F0F03",
  "line": "#48240F",
  "sel": "#FAAA48",
  "box": "#3E1A08"
 },
 "roles": {
  "Title": {
   "font": "Seravek,'Avenir Next',Corbel,sans-serif",
   "size": 60,
   "weight": 600,
   "lh": 66,
   "ls": -0.5,
   "color": "var(--fg)",
   "cw": 0.45
  },
  "Supertitle": {
   "font": "Seravek,'Avenir Next',Corbel,sans-serif",
   "size": 12,
   "weight": 600,
   "lh": 16,
   "ls": 2.6,
   "color": "var(--accent)",
   "tt": "uppercase",
   "cw": 0.8
  },
  "H1": {
   "font": "Seravek,'Avenir Next',Corbel,sans-serif",
   "size": 33,
   "weight": 600,
   "lh": 40,
   "ls": -0.2,
   "color": "var(--fg)",
   "cw": 0.5
  },
  "H2": {
   "font": "Seravek,'Avenir Next',Corbel,sans-serif",
   "size": 21,
   "weight": 600,
   "lh": 28,
   "ls": 0,
   "color": "var(--fg)",
   "cw": 0.48
  },
  "Body": {
   "font": "'Avenir Next',Avenir,'Segoe UI',sans-serif",
   "size": 16,
   "weight": 400,
   "lh": 26,
   "ls": 0,
   "color": "var(--fg)",
   "cw": 0.48
  },
  "Caption": {
   "font": "'Avenir Next',Avenir,'Segoe UI',sans-serif",
   "size": 13,
   "weight": 400,
   "lh": 19,
   "ls": 0,
   "color": "var(--muted)",
   "cw": 0.44
  },
  "Label": {
   "font": "ui-monospace,Menlo,Consolas,monospace",
   "size": 10,
   "weight": 500,
   "lh": 14,
   "ls": 1.2,
   "color": "var(--muted)",
   "tt": "uppercase",
   "cw": 0.72
  },
  "Stat": {
   "font": "Seravek,'Avenir Next',Corbel,sans-serif",
   "size": 46,
   "weight": 600,
   "lh": 50,
   "ls": -1,
   "color": "var(--accent)",
   "cw": 0.5
  }
 },
 "pad": {
  "chip": "4px 11px",
  "pill": "6px 16px"
 },
 "margin": 80,
 "gap": 5
}
